{
  "contract_version": 1,
  "proposal_id": "sid-tattoo-p4",
  "geometry": {
    "id": "karv-chair",
    "version": 2,
    "sha256": "878a8b89aa330da1dc7a4be00a5de6c0321ab1273c90c414ed1f22fc851df1bf"
  },
  "validation_status": "approved",
  "revestimentos": [
    {
      "kind": "custom",
      "proposal_id": "sid-tattoo-p4",
      "surface_id": "seat",
      "asset_version": 1,
      "validation_status": "approved",
      "base_color": {
        "uri": "/proposal-assets/sid-tattoo-p4/v1/seat.webp",
        "media_type": "image/webp",
        "sha256": "68919c42de5e959bce9c6839ec9d3bc5825ba29646558a7f3c962cfc15c816f9",
        "byte_length": 1022360,
        "width_px": 3548,
        "height_px": 2367
      },
      "physical_size_mm": {
        "width": 600,
        "height": 800
      },
      "orientation": "canonical-uv",
      "lifecycle": "archive-on-replacement"
    },
    {
      "kind": "custom",
      "proposal_id": "sid-tattoo-p4",
      "surface_id": "backrest-front",
      "asset_version": 1,
      "validation_status": "approved",
      "base_color": {
        "uri": "/proposal-assets/sid-tattoo-p4/v1/backrest-front.webp",
        "media_type": "image/webp",
        "sha256": "8157e435fc91843ba80dcd1bb3eca748e086091c3b5323c15204d42437692362",
        "byte_length": 1633538,
        "width_px": 3074,
        "height_px": 4096
      },
      "physical_size_mm": {
        "width": 600,
        "height": 400
      },
      "orientation": "canonical-uv",
      "lifecycle": "archive-on-replacement"
    },
    {
      "kind": "custom",
      "proposal_id": "sid-tattoo-p4",
      "surface_id": "backrest-side",
      "asset_version": 1,
      "validation_status": "approved",
      "base_color": {
        "uri": "/proposal-assets/sid-tattoo-p4/v1/backrest-side.webp",
        "media_type": "image/webp",
        "sha256": "7d562c1061efcdf16d4cedb347ad4e1aa1b7bafd8a16faf1d5859d2c7e60ffc7",
        "byte_length": 283488,
        "width_px": 1233,
        "height_px": 1253
      },
      "physical_size_mm": {
        "width": 209.24,
        "height": 212.112
      },
      "orientation": "canonical-uv",
      "lifecycle": "archive-on-replacement"
    },
    {
      "kind": "custom",
      "proposal_id": "sid-tattoo-p4",
      "surface_id": "backrest-rear",
      "asset_version": 1,
      "validation_status": "approved",
      "base_color": {
        "uri": "/proposal-assets/sid-tattoo-p4/v1/backrest-rear.webp",
        "media_type": "image/webp",
        "sha256": "48aa8122e3373ded8006e15e9f8cfd98459253196950c6462823381bdd2a8b72",
        "byte_length": 1732012,
        "width_px": 3074,
        "height_px": 4096
      },
      "physical_size_mm": {
        "width": 600,
        "height": 800
      },
      "orientation": "canonical-uv",
      "lifecycle": "archive-on-replacement"
    },
    {
      "kind": "custom",
      "proposal_id": "sid-tattoo-p4",
      "surface_id": "side-outer",
      "asset_version": 1,
      "validation_status": "approved",
      "base_color": {
        "uri": "/proposal-assets/sid-tattoo-p4/v1/side-outer.webp",
        "media_type": "image/webp",
        "sha256": "b2a2ba20ff5672f04198948ef5cc10ff30de647b095701c7354f7dce92a1b90f",
        "byte_length": 1303076,
        "width_px": 4096,
        "height_px": 2582
      },
      "physical_size_mm": {
        "width": 744.1,
        "height": 476.088
      },
      "orientation": "canonical-uv",
      "lifecycle": "archive-on-replacement"
    },
    {
      "kind": "custom",
      "proposal_id": "sid-tattoo-p4",
      "surface_id": "side-inner",
      "asset_version": 1,
      "validation_status": "approved",
      "base_color": {
        "uri": "/proposal-assets/sid-tattoo-p4/v1/side-inner.webp",
        "media_type": "image/webp",
        "sha256": "a84c8fbc2bdc8d558f434f92c081e13cd2e162fb11b7a88b7960592ebc0cd33f",
        "byte_length": 403370,
        "width_px": 2949,
        "height_px": 1047
      },
      "physical_size_mm": {
        "width": 499.299,
        "height": 180.458
      },
      "orientation": "canonical-uv",
      "lifecycle": "archive-on-replacement"
    }
  ],
  "public_metadata": {
    "title": "SID Tattoo — Tema 2 · P4"
  }
}
